LABEL,Date,Source,Title,Headline
wildfire,2023-09-16,NPR,Hawaii s spirit of aloha helps restore a wildfire damaged community,Native Hawaiians say the aloha spirit is unique and it s helping them recover
wildfire,2023-09-15,NPR,Preparing homes for wildfires is big business that s only getting started,Climate change technological leaps panicked insurers the shifting sense of responsibility All are powering the still nascent but fast growing industry of preparing homes for wildfires
wildfire,2023-09-26,NPR,First of thousands of Lahaina residents return to homes destroyed by deadly wildfire,In the days after the Aug wildfire some people were able to return to their properties to evaluate the damage But since then the burned area has been off limits to all but authorized workers
wildfire,2023-09-08,Engadget,FAA grounds Starship until SpaceX takes corrective actions,SpaceX s Starship test launch in April will be its last for the foreseeable future The FAA announced Friday that it has closed its investigation into April s mishap but that the company will not be allowed to resume test launches until it addresses a list o
wildfire,2023-09-08,ABC News,Maui slowly trudges toward rebuilding month after the deadly wildfire devastation,A month after the deadly wildfire devastation Maui slowly trudges toward rebuilding
wildfire,2023-09-15,ABC News,House Oversight Committee launches probe into Maui wildfire federal response,A Republican led House Oversight Committee is launching a probe into the federal Maui wildfire response
wildfire,2023-09-21,ABC News,Wildfire prone California to consider new rules for property insurance pricing,A new plan from California s insurance commissioner aims to keep the nation stop insurers from leaving the wildfire prone state
wildfire,2023-09-16,NPR,DNA tests lower the death toll in Maui fire to,Officials previously said at least people had died in the fire but further testing showed they had multiple DNA samples from some of the victims The number of those who are missing fell to
wildfire,2023-09-14,ABC News,This is where record breaking wildfires have been occurring all over the world,Boreal forests in regions all over the world have been experiencing the worst wildfires in recorded history in according to new research
wildfire,2023-09-04,Business Insider,A man is dead after a gender reveal stunt involving an airplane ended in a fatal crash,A gender reveal party in Mexico resulted in a fatal plane crash and it isn t the first death attributed to a gender reveal stunt
wildfire,2023-09-14,ABC News,Sydney blanketed by smoke for a th day due to hazard reduction burning,Sydney is blanketed under thick wood smoke for a fourth consecutive day due to hazard reduction burns in preparation for the wildfire season
wildfire,2023-09-19,Engadget,We put the Dyson Zone s air filters to the test Here s what we found,This spring Dyson launched the Zone which pairs noise canceling headphones with an air purifying visor It was swiftly met with backlash for its funky bane like aesthetic Oh and it s price tag What no one could have predicted is that just a few mon
wildfire,2023-09-24,ABC News,Residents prepare to return to sites of homes demolished in Lahaina wildfire,Authorities on Monday will begin allowing the first residents and property owners to return to their devastated properties in Lahaina many for the first time since the historic town was demolished by a wildfire nearly seven weeks ago
wildfire,2023-09-20,Boing Boing,Lahaina s Banyan tree grows new leaves,In a sign the Hawaii Department of Land and Natural Resources calls positive the year old block spanning tree is sporting clusters of new leaves After the terrible wildfire killed dozens of residents and left many still missing the survival of the
wildfire,2023-09-07,Wired,Best Deals Recycled Bags and Clothing Smartwatches and Headphones,Treat yourself while saving money on these recycled accessories the planet will thank you Or take advantage of eye watering price cuts on Samsung smartwatches and earbuds
wildfire,2023-09-18,Slate Magazine,I ve Become Obsessed With Tracking Wildfires I Noticed a Scary Truth,Fire season is long gone
wildfire,2023-09-30,Business Insider,Trump suggests bizarre plan to keep forests damp to prevent wildfires in California,The former president suggested that California kept its roughly million acres of forest damp to prevent wildfires
wildfire,2023-09-12,Vox,Wildfire risk is everywhere and growing,The ingredients for catastrophic wildfires are found in all corners of the country Here are areas facing increased risk
wildfire,2023-09-16,Slashdot.org,Researchers Including Microsoft Spot Chinese Disinformation Campaign Using AI Generated Photos,Until now China s influence campaigns have been focused on amplifying propaganda defending its policies on Taiwan and other subjects reports the New York Times But a new piece co authored by the newspaper s national security correspondent and its misin
wildfire,2023-09-25,Science Daily,By air rain and land How microbes return after a wildfire,Ecological disturbances like wildfires disrupt microbial communities Researchers found that dispersal played a pivotal role in re establishing surface level communities
wildfire,2023-09-19,Business Insider,Louisiana is the latest state to fall in the face of rising insurance costs,Louisiana joins states like Florida and California in dealing with high home insurance premiums making hard for homeowners to keep up
wildfire,2023-09-09,Scientific American,Large Herbivores Can Help Prevent Massive Wildfires,Reintroducing large herbivores into fire prone areas can help combat the global rise in megafires
wildfire,2023-09-13,Politico,Newsom Wildfire insurance crisis is a waving red flag,Newsom made the remarks after state lawmakers failed to reach a deal on wildfire insurance availability this session
wildfire,2023-09-07,Phys.Org,The timing of fireworks caused wildfire ignitions during the Fourth of July holiday season,Every year on the Fourth of July fireworks cause cause a precipitous increase of wildfire ignitions in the United States U S This human environmental phenomenon is noteworthy and highlights the impact of American culture on wildfire activity in the U S
wildfire,2023-09-05,Futurity: Research News,Wildfire smoke linked to higher ER visit risk for people of all ages,we re all at risk of health impacts says Annie Doubleday we all should be taking steps to reduce exposure and watching for any symptoms
wildfire,2023-09-04,Phys.Org,Massive Greece wildfire coming under control govt,Firefighters are gaining the upper hand on the massive blaze that has been raging for two weeks in the Dadia National Park in northeastern Greece authorities said Monday
wildfire,2023-09-06,Phys.Org,New research highlights opportunities to protect carbon and communities from forest fires,As the climate and wildfire crises have intensified so too have concerns regarding the loss of carbon captured and stored in forests from decades to centuries of tree growth A new study describes where to optimize ongoing wildfire mitigation efforts and red
wildfire,2023-10-03,Business Insider,Climate change is coming for your monthly mortgage payment Here s how to keep your costs down,Those who pay their homeowners insurance as part of their mortgage could see their monthly mortgage payments rise as climate change gets more costly for insurers
wildfire,2023-09-11,The Next Web,Space startup bags M to fight climate change with satellites,Space startup Open Cosmos will accelerate its mission to protect our planet after raising mn in a new funding round The UK based company uses satellites to tackle environmental issues By tapping AI sensors and Earth Observation EO imagery the probes
wildfire,2023-09-05,BBC News,Voice referendum Lies fuel racism ahead of Australia s Indigenous vote,Experts express concerns for First Nations people as a referendum debate turns increasingly divisive
wildfire,2023-09-07,CNET,Summer Isn t Done With Triple Digit Heat Waves Expected to Hit This Weekend CNET,There s only two weeks of the season left but triple digit temperatures persist
wildfire,2023-09-28,ABC News,Hawaii energy officials to be questioned in House hearing on Maui wildfires,A congressional hearing seeks answers about how the deadly Maui wildfires started or could have been prevented or mitigated
wildfire,2023-10-02,Phys.Org,Canada left battered by never before seen wildfire season,When scientists started pouring over data to assess Canada s fire season this year they struggled to find the right superlatives
wildfire,2023-09-09,Cheezburger.com,Over hectares burned Arrogant supervisor pushes his railroad workers to bend the rules on safety protocols starts a raging wildfire then gets justly fired for negligence,Some people just want to watch the world burn But when you re the one guy who s only job is to prevent destruction from consuming the job site that s exactly what you re trying to avoid For some supervisors especially the arrogant kind with a i can do no
wildfire,2023-09-08,NPR,California lawmakers ban most hand count elections targeting far right Shasta County,Most California elections will be forced to use state approved machines to count ballots under a bill that follows an attempt by right wing supervisors in one county to hand count future elections
wildfire,2023-09-29,NPR,Up First briefing Affects of a shutdown health workers may strike Maui conspiracies,What will stay open if the government shuts down Kaiser Permanente s health care workers near a nationwide walkout How conspiracy theories spread in the wake of wildfires in Hawaii
wildfire,2023-09-06,NPR,He came to Maui to find his granddad He wound up giving out thousands in aid money,Kian Lutu says it was his duty to volunteer in shelters and dole out donations It s one example of how Maui s communities and families banded together after last month s wildfires
wildfire,2023-09-09,NPR,Pop up units spring up after Maui fire disaster giving families a place to call home,In Hawaii people who lost their homes to wildfires could soon be living in a pop up village with space for around people
wildfire,2023-09-20,Phys.Org,Socially vulnerable populations are disproportionately exposed to wildfires in the West study finds,People experiencing a high degree of social vulnerability are also more exposed to wildfires in Oregon and Washington as wildfire risk increases a new study shows
wildfire,2023-09-15,Phys.Org,How climate assemblies can help Canada tackle the climate crisis,Canada s ongoing and record breaking wildfire season and the recent heat waves around the world have galvanized Western public attention to the climate crisis like never before
wildfire,2023-09-25,Business Insider,Millennials looking to buy a home are worrying about climate risk They re not wrong,Over of millennials looking to purchase a home said climate risks were an extremely impactful factor in their search a Zillow study found
wildfire,2023-09-25,Business Insider,As the climate crisis makes life more expensive a financial planner says there are good options to save money,As the climate crisis grows worse it s important to be prepared Tax rebates for climate conscious energy can help make that preparation easier
wildfire,2023-09-20,Phys.Org,Examining how much wildfire smoke influences air quality trends,Stanford research reveals the rapidly growing influence of wildfire smoke on air quality trends across most of the United States Wildfire smoke in recent years has slowed or reversed progress toward cleaner air in states erasing a quarter of gains made s
wildfire,2023-09-12,Phys.Org,California firefighters use AI to battle wildfires,When a wildfire erupted in the middle of a recent California night it could have been a disaster
wildfire,2023-10-03,DIYphotography,AI strikes again Image of shirtless man kicking an alligator fools the internet,As AI image generators become more advanced it becomes increasingly difficult to tell AI from real images So it s no wonder that yet another AI creation has been fooling people over the past few days The image is downright bizarre showing a half naked ma
wildfire,2023-10-03,Politicopro.com,FEMA Disaster Money Flowing Again after Budget Standoff,The Federal Emergency Management Agency will resume funding long term rebuilding projects after withholding funds since August
wildfire,2023-09-11,Scientific American,How Fires Floods and Hurricanes Create Deadly Pockets of Information Isolation,Telecommunications grids are vulnerable to worsening climate disasters mdash which highlights the importance of one age old survival system
wildfire,2023-09-21,Scientific American,A Record Number of Billion Dollar Disasters Show U S Isn t Ready for Climate Change,The U S has already seen a record number of disasters costing at least billion in which underscores how unprepared the nation is to withstand climate driven catastrophe
wildfire,2023-09-25,Phys.Org,Q A How extreme weather impacts fall foliage,After a summer of extreme weather historic rainfall devastating floods wildfire smoke leaf peeping season has finally arrived in Vermont and New England
wildfire,2023-09-16,ReadWrite,Digital PR Building an Online Reputation and Boosting Visibility,In today s hyper connected digital world businesses and individuals find themselves navigating a complex web of online interactions as the social The post Digital PR Building an Online Reputation and Boosting Visibility appeared first on ReadWrite
wildfire,2023-09-09,Quartz India,Most of West Maui will welcome back visitors next month under a new wildfire emergency proclamation,HONOLULU Hawaii AP Most of West Maui will officially reopen to travelers Oct under a new wildfire emergency proclamation signed on Friday by Hawaii Gov Josh Green Read more
wildfire,2023-09-13,Cheezburger.com,My tenant did over in damages Guy gives an atrocious tenant a good referral after her future landlord gets snarky on the phone with him,There s a fragile balance of power when renters hand over a check to their landlord every month Landlords need that money to come in and tenants need to live somewhere so there s a predictable symbiosis in their relationship Usually landlords are the ones
wildfire,2023-09-05,Al Jazeera English,Greece firefighters battle to bring massive fire under control,Wildfires are common in Greece and other Southern European countries during their hot dry summers
wildfire,2023-09-29,Phys.Org,Is California s wildfire season finally over Don t bet on it experts say,California has entered fall amid notably moist conditions that have left some wondering whether this year s fire season has officially fizzled
wildfire,2023-09-09,Phys.Org,Mapped Forest fire hot spots where treatment offers the biggest payoff for people and climate,The U S government is investing over US billion in the coming years to try to manage the nation s escalating wildfire crisis That includes a commitment to treat at least million acres in the next years by expanding forest thinning efforts and contro
wildfire,2023-09-20,NPR,At new mental health courts in California judges will be able to mandate treatment,In several California counties new mental health courts open up in October Officials hope to persuade people with psychosis to accept treatment Critics say it looks more like coercion
wildfire,2023-09-17,NPR,Thousands expected to march in New York to demand that Biden end fossil fuels,The protest comes after a summer of extreme weather events and just ahead of a U N summit aimed at prodding global leaders to cut emissions more quickly
wildfire,2023-09-09,Phys.Org,Scientist shocks peers by tailoring climate study,In a controversial bid to expose supposed bias in a top journal a US climate expert shocked fellow scientists by revealing he tailored a wildfire study to emphasize global warming
wildfire,2023-09-08,Phys.Org,Wildfires have wreaked havoc this summer but these plants were prepared,Summer has seen wildfire crews tirelessly battle forest fires worldwide The Canary Islands a Spanish archipelago off the Moroccan coast have faced their worst fires in years but amid the devastation lies a remarkable tale of resilience
wildfire,2023-09-27,Al Jazeera English,Lahaina family finds devastation in first visit home after deadly wildfire,Vierra family are among first group of Lahaina residents able to return home after blazes swept across Hawaiian island
wildfire,2023-09-09,The Mercury News,San Francisco scientist says he left out full truth to get climate change wildfire study published,San Francisco scientist says he left out full truth to get climate change wildfire study published First column th story link Drudge Report Feed needs your support Become a Patron
wildfire,2023-10-02,Phys.Org,Climate and human land use both play roles in Pacific island wildfires past and present Study,It s long been understood that human settlement contributes to conditions that make Pacific Islands more susceptible to wildfires such as the devastating Aug event that destroyed the Maui community of Lahaina But a new study from SMU fire scientist Chris
wildfire,2023-09-11,CBC News,N W T officials give update on wildfire activity,Officials in the N W T are holding a news conference at p m MT Monday to give the latest on the territory s wildfires and evacuations
wildfire,2023-09-08,Phys.Org,Wildfire smoke from Canada continues to impact Kansas City s air quality What do monitors show,Smoke from wildfires in western Canada has decreased over the Kansas City area but air quality in the metro remained at unhealthy levels for some people by Friday morning according to the website AirNow gov
wildfire,2023-09-11,Phys.Org,Scientist says he left out the full truth to get climate change wildfire study published in journal,A new study by a team of mostly San Francisco Bay Area scientists that found human caused climate warming has increased the frequency of extremely fast spreading California wildfires has come into question from the unlikeliest of critics its own lead author
wildfire,2023-09-27,Phys.Org,Workshop synthesis paper describes value of prescribed fire in wilderness areas,Many of the wilderness areas that we treasure were historically shaped by fire Yet today many wilderness landscapes are caught in the wildfire paradox widespread suppression and exclusion of burning over the last century have increased the likelihood of hig
wildfire,2023-09-18,Time,Tens of Thousands Protest For an End to Fossil Fuels As World Leaders Gather in New York,Ahead of the U N General Assembly and New York Climate Week protesters call for an end to fossil fuels
wildfire,2023-09-06,Time,The Northern Hemisphere Just Lived Through Its Hottest Summer Ever Recorded,Scientists blame human caused climate change from burning coal oil and natural gas with an extra push from a natural El Nino
wildfire,2023-09-24,Time,What to Know About The Saltwater Threat to Louisiana s Drinking Water Supply,A long lasting drought in Louisiana is impacting the drinking water from the Mississippi River posing a risk for the state s residents
wildfire,2023-09-07,Time,What Companies Can Learn About Climate Action From a Study on Plastic Take Out Cutlery,Researchers tried a simple fix to the pervasive problem of wasted plastic cutlery The findings show how companies can promote better habits
wildfire,2023-10-02,EurekAlert,Researchers find a cause of Parkinson s disease Mitochondrial DNA damage,p A significant breakthrough sheds light on the underlying mechanisms of Parkinson s disease offering the potential for innovative treatments in the future p
wildfire,2023-09-17,Al Jazeera English,Greece is fighting wildfires the wrong way,A strategy focusing largely on boosting a firefighting force won t save the country from climate crisis fuelled blazes
wildfire,2023-09-13,Vox,There is no end to disaster season anymore,An extraordinary autumn is expected after a record smashing summer
wildfire,2023-09-21,Grist,Study Wildfire smoke is reversing years of US air quality progress,A new study finds wildfire smoke has undone up to years of air quality improvements achieved in the U S since
wildfire,2023-09-22,CBC News,Enterprise N W T lifts evacuation order for damaged but not destroyed hamlet,Residents of Enterprise N W T can return to the damaged but not destroyed hamlet after a wildfire took per cent of the community
wildfire,2023-09-03,CBC News,First Nation regional district in central B C Interior orders wildfire evacuations,Weekend winds in British Columbia s central Interior resulted in increased wildfire activity and saw evacuation orders in remote areas north of Burns Lake
wildfire,2023-09-07,Politicopro.com,Nearly Neighborhoods Prone to Climate Disasters Will Get Extra Money for Resilience,U S census tracts with high exposure to climate impacts will get extra federal funds to build resilience
wildfire,2023-09-11,Yahoo Entertainment,Lahaina s fire stricken Filipino residents are key to tourism and local culture Will they stay,Ambulance and fire truck sirens wailed outside as Elsie Rosales stripped linens from king sized mattresses at a beachfront resort in Lahaina All our hard
wildfire,2023-09-06,New Scientist,Earth has just seen its hottest three month spell on record,The global average temperature for June July and August was C F beating the previous record set in by almost three tenths of a degree
wildfire,2023-09-28,NPR,How rumors and conspiracy theories got in the way of Maui s fire recovery,Some of the rumors and conspiracy theories were driven by the island s history but others were pushed by social media influencers and foreign governments
wildfire,2023-09-26,CBC News,These goats are constantly eating to prevent wildfires in the California countryside,Michael Choi organizes a herd of goats that eat their way through the brush of California clearing away the fuel a wildfire needs to spread
wildfire,2023-09-11,Forbes,Disaster Recovery Will Be Hard In Maui Toxic Waste Makes It Harder,People in Maui face a wildfire recovery and a complex environmental justice landscape Toxic chemicals left behind from the fires complicate cleanup
wildfire,2023-09-05,Al Jazeera English,Torrential rains batter Greece after wildfires,Storm Daniel floods homes and roads in central Greece prompting authorities to order vehicles off the streets
wildfire,2023-09-17,Grist,Hawaii needs to build hundreds more miles of firebreaks to protect against wildfire,Fire officials and landowners have known for years about gaps in Hawaii s firebreaks and fuelbreaks The problem boils down to money and cooperation
wildfire,2023-10-03,CBC News,Effects of N W T wildfire smoke will take years to study,Air quality in the N W T is on track to be the worst on record While the goal now is to collect the data but the impact will take many years to determine
wildfire,2023-09-16,Space.com,NASA confirms summer was Earth s hottest on record,summer was Earth s hottest since global record keeping of temperatures began in NASA announced Thursday Sept
wildfire,2023-09-05,Phys.Org,Q A Professor explains what municipal governments are doing as climate change accelerates,July was the hottest month globally since humans began keeping records People all over the U S experienced punishingly high temperatures this summer In Phoenix there were a record setting consecutive days with a high temperature of F or more
wildfire,2023-09-13,Phys.Org,What does carbon offset actually mean for US forests,While cars airplanes and factories are busy spewing carbon dioxide into the atmosphere trees spend much of their time absorbing this harmful greenhouse gas via photosynthesis
wildfire,2023-09-14,NPR,Some parents in Lahaina fight to keep their school and kids together,Schools remain closed after the deadly fires on Maui Parents say it s important to keep their community from being displaced indefinitely
wildfire,2023-09-04,The New Yorker,Myths and Facts About Climate Change,Shouts Murmurs by Jay Katsir Arctic temperatures are climbing faster than those in equatorial regions and Ryan Gosling has never been hotter
wildfire,2023-09-07,Phys.Org,Nature holds the answer to limiting the impact of extreme weather say new guidelines,Wildfires flooding and extreme heat these perils are threatening Canada s residential housing market and homeowners in ways not imagined just a few years ago
wildfire,2023-09-16,CBC News,Hay River N W T residents can start returning on Saturday as wildfire evacuation order lifted,Residents of Hay River N W T will at last be able to return home on Saturday
wildfire,2023-09-16,CBC News,DNA results drop confirmed Maui wildfire death toll to officials say,Authorities in Hawaii have adjusted the number of deaths from the deadly Maui wildfires down to at least people
wildfire,2023-10-02,Forbes,Wildfire Haze Could Return To Northeastern U S This Week As Canadian Fires Burn,New York City Mayor Eric Adams warned residents to listen to their bodies and to take necessary precautions to ensure they stay safe
wildfire,2023-09-16,CBC News,Hay River N W T residents can start returning on Saturday as wildfire evacuation order lifted,Residents of Hay River N W T will at last be able to return home on Saturday
wildfire,2023-09-13,Forbes,Why Now Is The Time To Focus On Wildfire Prevention And Restoration,The search engine Ecosia recently announced it will invest into prevention and restoration schemes
wildfire,2023-09-11,Al Jazeera English,US sees record number of billion dollar disasters so far this year,Government agency NOAA tallied billion dollar weather disasters surpassing a previous record set the year before
wildfire,2023-09-07,CBC News,Parts of Canada could see wildfires through winter federal forecast says,The latest federal government forecast says Canada s already unprecedented wildfire season could continue late into the fall or winter
