LABEL,Date,Source,Title,Headline
fire,2023-09-30,ABC News,Cleveland Browns tight end David Njoku burned on face arm in home accident while lighting fire pit,Cleveland Browns tight end David Njoku suffered burns to his face and arm in an accident at home while lighting a fire pit
fire,2023-10-03,ABC News,dead in shooting in major shopping mall in Bangkok suspect in police custody,Authorities in Thailand s capital say three people were killed when a shooter opened fire in a major shopping mall in the center of Bangkok
fire,2023-10-03,ABC News,WATCH Lightning strike causes fireball lights up skies in England,An explosion illuminated the skies over Oxford England on Monday after lightning struck gas containers at a waste plant causing a large fire
drought,2023-09-21,Business Insider,The true cost of extreme weather,Extreme weather is costing all of us money in ways we don t always see Heat illnesses drought deep freezes and floods It s adding up
drought,2023-09-06,Business Insider,Thieves reportedly stole of olive oil after drought boosted prices turning it into liquid gold,Olive oil production has been hampered by droughts and heatwaves so the price is going up and one Spanish oil mill was robbed of liters
drought,2023-10-03,NPR,More than dolphins found dead in Brazilian Amazon as water temperatures soar,Experts believe high water temperatures are the most likely cause of the deaths in the lakes in the region Temperatures since last week have exceeded degrees Fahrenheit in the Tefe Lake region
drought,2023-09-27,Wired,The Climate Crisis Is Driving People to Substance Abuse,Extreme weather has decimated crops and incomes in northern India To soothe their anxiety agricultural workers are turning to tobacco and alcohol
drought,2023-09-24,Time,What to Know About The Saltwater Threat to Louisiana s Drinking Water Supply,A long lasting drought in Louisiana is impacting the drinking water from the Mississippi River posing a risk for the state s residents
drought,2023-10-02,Business Insider,Panama Canal slashes the number of ships allowed through drought means there isn t enough water in the channel,The Panama Canal restricted the number of boats that can cross a day after an unseasonably dry year The figure is now instead of its usual
drought,2023-10-03,Time,Thousands of Fish Dolphins Are Dying in the Brazilian Amazon as Water Temperatures Soar,Experts believe high water temperatures in the lakes in the region are the most likely cause of the deaths Thousands of fish have also died as the region grapples with a severe drought
drought,2023-09-23,ABC News,Salt water intrusion in Mississippi River could impact drinking water in Louisiana,A saltwater intrusion in the Mississippi River poses a threat to Louisiana s water supply The river has low water levels due to drought conditions allowing an intrusion
drought,2023-09-21,ABC News,million people asked to conserve water in Seattle because of statewide drought,Seattle Public Utilities is asking about million customers in the Seattle area to use less water amid ongoing drought conditions
drought,2023-09-06,BBC News,Claude the koala unmasked as prolific plant thief in Australia,It ate thousands of seedlings that had been earmarked to help boost Australian koala numbers
drought,2023-09-07,BBC News,Why Vancouver is letting go of green lawns,The Canadian city is choosing sustainability over aesthetics as it deals with a severe drought
drought,2023-09-06,Business Insider,The congestion at the Panama Canal is so bad that some shippers are even paying millions for each ship to cross,The congestion in the Panama Canal is closely watched because of US container traffic passes through the waterway
drought,2023-09-07,The Verge,Companies aren t showing whether their environmental promises have any impact,An analysis of of the world s biggest companies found that most of them are failing to report on how successful their commitments to restore ecosystems have been
drought,2023-09-29,Business Insider,Europe is almost out of local olive oil supplies as extreme weather takes a toll on harvests,Extreme weather has hurt another year of olive harvests in Europe To deal with olive oil shortages supplies are being imported from South America
drought,2023-09-06,NPR,Green groups sue say farmers are drying up Great Salt Lake,Environmental groups have filed suit against the state of Utah arguing leaders aren t doing enough to prevent the state s namesake Great Salt Lake from drying up
drought,2023-09-05,Business Insider,Argentina should avoid dollarization as it can trap the country in Ecuador like economic morass one economist says,Some in Argentina romanticize Ecuador s dollarization Reality is different IIF s chief economist said pointing to Ecuador s chronic low growth
drought,2023-09-12,BBC News,The app teaching Somalis to read and write,The technology means that learning is taken out of school to where many Somalilanders live and work
drought,2023-09-28,Boing Boing,A I reveals the astonishing number of mysterious fairy circles around the globe,Fairy circles are round patches of barren land often surrounded by grass Various hypotheses have been suggested about what causes them from gods and spirits to termites unusual climate conditions or self organizing properties of plants Previously fairy
drought,2023-09-12,Business Insider,Add the climate crisis to the long list of things messing up supply chains this summer,The climate crisis is throwing a wrench into supply chains that were already disrupted by the pandemic geopolitical tensions and rising costs
drought,2023-10-02,Vice News,The Amazon Is Getting So Hot That Dolphins Are Dying En Masse,More than Amazon river dolphins have died in the sweltering waters of Brazil s Lake Tef which recently hit degrees
drought,2023-09-29,Time,Famine in the st Century Must be a Red Line Here s What We Can Do,Until recently success in the fight against global famine was one of humanity s greatest achievements
drought,2023-09-04,University of Leeds,Extreme El Ni o weather switched off South American s carbon sink,Tropical forests in South America lose their ability to absorb carbon from the atmosphere when conditions become exceptionally hot and dry according to new research
drought,2023-09-06,Business Insider,Insider Today IPOs make or break moment,Chip design firm Arm s upcoming IPO comes at a critical time for the public markets Meanwhile Apple s iPhone will require a new charger
drought,2023-09-07,BBC News,NFL season Super Bowl or bust for Aaron Rodgers Will Patrick Mahomes cement dynasty,After seasons with Green Bay four time NFL MVP Aaron Rodgers plays for a new team this weekend while Patrick Mahomes and the Kansas City Chiefs begin their title defence
drought,2023-09-13,The Next Web,Carbon offset data startup Treefera raises M to map forests with AI,Treefera says it wants to transform the accuracy transparency and efficiency of the carbon offset industry with AI and data from a trillion trees across the globe It just received a vote of confidence in the form of a mn seed round led by Concept Venture
drought,2023-09-04,Bleacher Report,Free Agent Contracts Dolphins Must Pursue After Preseason,After ending a five year playoff drought last season the Miami Dolphins have even larger aspirations for the NFL campaign They still haven t won a
drought,2023-09-14,Phys.Org,Heat drought fires threaten Lebanon s northern forests,Heat waves low rainfall and the threat of wildfires are compounding the woes of people in the forested north of Lebanon a country where economic pain has long taken prominence over environmental concerns
drought,2023-09-12,Phys.Org,Global droughts found to differ by coastal or inland location with only accompanied by heat waves,Can a coastal area have a drought Yes but it ll look different than an inland drought according to new research from team based at Fudan University in China More surprising than the geographically influenced characteristics of droughts the researchers sa
drought,2023-10-01,Phys.Org,Drought drains Brazilian Amazon residents reliant on waterways,Not far from the emblematic site where the black waters of the Rio Negro join the brown currents of the Solimoes two chief tributaries of the Amazon what once was a lake has given way to a vast stretch of cracked mud
drought,2023-09-11,Rolling Stone,Zach Bryan Remains Tops Album Chart For Second Consecutive Week,Doja Cat s Paint The Town Red dethroned Bryan on the singles chart and broke rap s year long drought without topping the Hot
drought,2023-09-13,Al Jazeera English,Is a global body needed to deal with natural disasters,Earthquakes floods fires storms and drought have ravaged many parts of the world on a scale not seen in decades
drought,2023-09-28,Al Jazeera English,Photos Amazon rainforest faces a severe drought affecting thousands,With river levels dropping water transportation has stalled and hundreds of dead fish are contaminating drinking water
drought,2023-09-13,Sky Sports,Richarlison to seek psychologist s help amid goal drought,Tottenham striker Richarlison says he will seek the help of a psychologist to improve his game and break his goal drought after returning from international duty with Brazil
drought,2023-09-06,Phys.Org,Q A Rather than colonizing space humankind needs to commit itself to saving the planet,Every day seems to bring news of multiplying ecological disasters fires floods drought deforestation overfishing and coral reef die offs
drought,2023-09-07,CNET,Summer Isn t Done With Triple Digit Heat Waves Expected to Hit This Weekend CNET,There s only two weeks of the season left but triple digit temperatures persist
drought,2023-09-29,Phys.Org,Study shows bacteria in the soil can defy periods of drought,While many bacteria become inactive during dry spells specific groups persist and even thrive A new study published in Nature Communications and conducted by the Center for Microbiology and Environmental Systems Science CeMESS at the University of Vienna
drought,2023-09-29,Phys.Org,Researchers reveal genetic and evolutionary characteristics of tricotyledony in sand rice,Known as a pioneer herb on the moving sand dunes of Central Asia sand rice has been recommended as a potential future crop due to its excellent drought tolerance and rich nutritional value
drought,2023-09-04,Phys.Org,Two dead three missing as torrential rains lash Spain,Two people died and three were missing on Monday after heavy rains lashed drought hit Spain triggering flash floods that closed Madrid metro lines and high speed rail links
drought,2023-09-14,NPR,What a crop of upcoming IPOs from Birkenstock to Instacart tells us about the economy,A crop of IPOs are coming starting with chip designer Arm which is making its debut on Thursday It s another sign of confidence in markets and the U S economy
drought,2023-10-01,NPR,Retired Red Sox knuckleballer Tim Wakefield dies at,His role in the Red Sox Yankees rivalry of the early s turned Wakefield into a fan favorite whose impact went far beyond his numbers
drought,2023-09-11,Time,Set a Record for Billion Dollar Weather Disasters in the U S And The Year Isn t Over Yet,The year isn t even over yet and already has seen a record number of weather disasters costing billion or more in the U S
drought,2023-10-02,Time,Montana Is Appealing Landmark Youth Climate Ruling,In August a judge ruled that Montana s environmental law violates the plaintiffs state constitutional rights to a clean environment
drought,2023-09-12,Phys.Org,What Arizona and other drought ridden states can learn from Israel s pioneering water strategy,Arizona is one of the fastest growing states in the U S with an economy that offers many opportunities for workers and businesses But it faces a daunting challenge a water crisis that could seriously constrain its economic growth and vitality
drought,2023-09-13,Phys.Org,Addis Ababa faces growing climate change risks such as heat drought and floods study warns,Addis Ababa Ethiopia s capital city will likely face increased heat waves droughts and severe flooding over the next years These changes will pose risks to public health and infrastructure They ll also be felt most acutely by the city s most vulnerabl
drought,2023-09-12,Time,Elizabeth Wathuti Is Planting the Seeds of Climate Action,Since Elizabeth Wathuti s organization has planted more than trees in her home country of Kenya
drought,2023-09-27,Forbes,InnovationRx Digital Health IPO Drought,InnovationRx is your weekly digest of healthcare news Sign up
drought,2023-09-15,Business Insider,Las Vegas is asking companies that want to move or expand there to show how much water they plan to use,Las Vegas officials are testing a tool that evaluates the water conservation efficiency of companies interested in moving to the area or expanding operations
drought,2023-09-11,Business Insider,The US has pumped so much groundwater that it s literally splitting the ground open across the American Southwest,Giant mile long cracks in the ground are turning up across the Southwestern US because Americans have pumped too much groundwater there
drought,2023-09-20,Business Insider,Mexico is trying to be best new trade buddies with both the US and China but it might not be able to handle the pressure,Mexico is now America s top trade partner and has benefited from acting as a middleman between US and China
drought,2023-09-13,Phys.Org,Ohio s droughts are worse than often recognized study finds,A new type of analysis suggests that droughts in Ohio were more severe from to than standard measurements have suggested
drought,2023-09-22,Business Insider,Climate Week can make me feel cynical but there are signs that change might be underway,It s easy to be cynical about Climate Week when politicians and execs talk a good game about environmental wins Yet there may be room for optimism
drought,2023-10-03,Polygon,What time does Assassin s Creed Mirage release,Assassin s Creed Mirage officially comes out on Oct Here s when it releases in your time zone depending on if you re playing on console or PC
drought,2023-09-08,ESPN,Campbell Lions Week win at Chiefs expected,After a win over the defending Super Bowl champion Chiefs Lions coach Dan Campbell said he wasn t surprised by the outcome
drought,2023-09-07,ESPN,Jets Rodgers rejects talk he has to bounce back,Jets quarterback Aaron Rodgers who is coming off the worst statistical season of his career said he doesn t feel like he has to prove anything this year
drought,2023-10-03,Al Jazeera English,Deaths of Amazon dolphins linked to severe drought high temperatures,Amazon River s pink grey dolphins are a threatened species and among the few freshwater dolphins found in the world
drought,2023-09-13,Phys.Org,Panama seeks new sources of water for canal,Panama is looking into new sources of water for the Panama Canal which moves six percent of global maritime trade but recently had to restrict traffic due to drought its operator said
drought,2023-10-02,Phys.Org,How plants survive droughts and extreme rainfall,Tropical ecosystems are constantly navigating between prolonged drought and extreme rainfall but little research has been done to understand why some plants are able to survive these swings in climate
drought,2023-09-12,Phys.Org,Water quality deteriorating in rivers worldwide due to climate change and increasing extreme weather events Study,Climate change and increases in drought and rainstorms pose serious challenges to our water management Not only the availability of water is under pressure but its quality is as well
drought,2023-09-14,The Indian Express,Govt should declare drought in state says Vijay Wadettiwar,He also pointed out that the chief Minister and two deputy chief ministers are busy in other issues instead of providing relief to farmers and agri sector
drought,2023-09-19,Phys.Org,It s an emergency Midwest towns scramble as drought threatens drinking water,James Rainbolt typically can tackle most problems at his rural water plant with some extra time or money
drought,2023-09-27,ArchDaily,House in the Dry MRTN Architects,Completed in in Moore Creek Australia Images by Anthony Basheer This semi rural house on ex grazing land in Tamworth was designed to transform a scrubby parched piece of land into an energy efficient contemporary
drought,2023-09-26,Phys.Org,Q A Study reveals long distance levers behind US Southwest drought and a dry future,The U S Southwest has been suffering a drought that began at the close of the th century now officially known as a megadrought due to its intensity and longevity Climate scientist Richard Seager has been studying it since the start Much of his research
drought,2023-09-14,Kotaku,Nintendo Is Doubling Down On Mario Games After The Super Mario Movie,If it feels like Nintendo has put a ton of Mario on the menu lately there s a clear explanation for the boom of Italian American fare and it s not that the Feast of San Gennaro is coming up Not long after its April debut The Super Mario Bros Movie became
drought,2023-09-06,Blogger.com,Fed s Beige Book Growth was modest during July and August,None
drought,2023-09-06,Grist,The planet just sizzled through the hottest summer on record,Scientists have long warned that scorching summers marked by heat waves freak storms and drought could become the norm
drought,2023-10-02,ABC News,Montana is appealing a landmark climate change ruling that favored youth plaintiffs,The office of Montana s Republican attorney general is appealing a landmark climate change ruling in which a judge said state agencies aren t doing enough to protect young plaintiffs from harm caused by global warming
drought,2023-09-08,Biztoc.com,A traffic jam in the drought stricken Panama Canal may affect global supply chains,A traffic jam in the drought stricken Panama Canal may affect global supply chains A drought is causing a slowdown in shipping traffic at the Panama Canal It s introducing new problems for the global supply chain panamacanal
drought,2023-09-13,Business Insider,Recognizing the rights of climate refugees is the first step to relocating the millions of vulnerable island nation residents who could be displaced in the next decades,While Caribbean islands have some of the lowest greenhouse gas emissions they re the most vulnerable to the impacts of the climate crisis
drought,2023-09-05,Business Insider,From non native bluegrass in Antarctica to beautiful spotted bugs in the middle of NYC here are invasive species that are as stunning as they are threatening to humanity,A United Nations report says invasive species are costing the world billion every year to combat And we are part of the problem
drought,2023-09-12,Forbes,How The Panama Drought Could Impact Holiday Shopping,The butterfly effect of a water shortage in Panama can have an impact on the global supply chain
drought,2023-09-05,Phys.Org,Study reveals molecular mechanism underlying cross membrane transport of plant hormone abscisic acid,Abscisic acid ABA is a key plant hormone produced in response to abiotic stress such as drought and salt It is mainly synthesized in roots and vascular tissues and transported to specific sites to exert physiological functions Several ABA transporters hav
drought,2023-09-29,Quartz India,Climate change over the last two decades is making the effects of El Ni o more extreme,Since there have been seven El Ni o events The last and strongest El Ni o of that time period lasted two years from This year El Ni o is back and may prove to be even stronger Rising global temperatures set a hotter baseline for this El N
drought,2023-10-03,IGN,Activision Promises to Continue to Support Call of Duty DMZ Beta Despite COD Next No Show,Activision has moved to pressure fans of Call of Duty s DMZ that it intends to continue supporting the extraction mode despite it skipping the upcoming COD Next reveal event
drought,2023-09-20,Quartz India,The world s future wheat will need to withstand the climate crisis,There s a race against time to figure out how to make wheat more climate resistant Demand for staple crops like wheat is only expected to increase as the climate crisis makes the world s food system more vulnerable Wheat makes up of calories in the aver
drought,2023-09-06,Time,America Should Harvest a Trillion Gallons of Rainwater,As droughts heighten interest in costly and controversial water megaprojects it s time to scale up a surprisingly simple solution
drought,2023-09-14,Time,The Air Was Hot This Year But It s Nothing Compared to the Ocean,Our fate is intimately tied to the fate of our warming oceans write Stephen Porder and Baylor Fox Kemper
drought,2023-09-04,Time,Africa Is Holding a Historic Climate Summit Here s What to Know,Here is what to know about the three day event which kicks off in Nairobi Kenya on Monday
drought,2023-09-18,Time,Tens of Thousands Protest For an End to Fossil Fuels As World Leaders Gather in New York,Ahead of the U N General Assembly and New York Climate Week protesters call for an end to fossil fuels
drought,2023-09-05,Biztoc.com,Could Texas drought reveal a town hidden under a lake,If Lake Belton water levels continue to drop the ghost town of Sparta hidden beneath may be revealed Drought has plagued the southwest United States for years drastically impacting water levels at popular reservoirs like Lake Mead and Lake Powell Lake Mea
drought,2023-09-08,Biztoc.com,Texas Suffers a Solar and Wind Power Drought,Triple digit temperatures aren t unusual during Texas summers but power shortages coupled with urgent orders to conserve electricity are now routine While Texans barely averted blackouts Wednesday evening the state s energy ordeals are a flickering warning
drought,2023-09-28,Biztoc.com,Europe s olive oil supply running out after drought,Europe has almost run out of local olive oil supplies and is set for more shortages after extreme weather damaged harvests for a second year The world s largest producer has said it is having to import supplies from South America to keep up with demand To
drought,2023-09-26,The A.V. Club,The Office might be returning to office,A million Michael Scott GIFs suddenly cried out in terror and were suddenly silenced
drought,2023-09-21,Deadspin,Buddy Hield is the type of player who could tilt the odds in a contender s favor,If there s any NBA trading block resident who deserves to transition to a contender this season it s not James Harden or Damian Lillard it s newcomer Buddy Hield At least Dame Time has advanced to the brink of a Conference Finals Hield has never even sail
drought,2023-09-16,Al Jazeera English,Somali PM Nearly years of fighting al Shabab,Premier Hamza Abdi Barre discusses why despite the international support for the army al Shabab remains powerful
drought,2023-09-07,Politicopro.com,Nearly Neighborhoods Prone to Climate Disasters Will Get Extra Money for Resilience,U S census tracts with high exposure to climate impacts will get extra federal funds to build resilience
drought,2023-09-12,NPR,Venice may be put on the endangered list thanks to human created climate change,The impacts of climate change including related disasters such as wildfires and sea level rise are increasingly raising a question about how best to save cultural heritage
drought,2023-09-05,Themarginalian.org,Kate Sessions and the Devotion to Delight The Forgotten Woman Who Covered California with Trees and Flowers,In May next to news of the Nazi savagely bombing London The Los Angeles Times published a memorial profile of California s Mother of Gardens a hopeful antidote to the undoing of the human world celebrating the woman who covered Southern California
drought,2023-09-04,Phys.Org,Extreme El Ni o weather saw South America s forest carbon sink switch off,Tropical forests in South America lose their ability to absorb carbon from the atmosphere when conditions become exceptionally hot and dry according to new research
drought,2023-10-01,ABC News,Tim Wakefield who revived his career and Red Sox trophy case with knuckleball has died at,Tim Wakefield the knuckleballing workhorse of the Red Sox pitching staff who bounced back after giving up a season ending home run to the Yankees in the playoffs to help Boston win its curse busting World Series title the following year has died
drought,2023-10-03,Euronews,Spain hit hard by rising price of olive oil as climate change takes its toll on production,Drought and extreme heatwaves have halved Spanish olive oil production The price at origin has increased by per cent since last year
drought,2023-09-04,ESPN,We simulated the entire NFL season Biggest storylines plus a bird friendly Super Bowl forecast,We played out one of our Football Power Index s season sims from Week through Super Bowl LVIII with playoff races surprises and more
drought,2023-09-17,Biztoc.com,Smaller boats help Rhine cargo shippers overcome mounting problem of drought,Family businesses turn to nimbler vessels that can operate when water levels are low
drought,2023-09-22,Space.com,Satellite spots marine heat wave off the California coast image,The Surface Water and Ocean Topography SWOT satellite recorded higher sea levels off California indicating a marine heat wave
drought,2023-09-12,Phys.Org,Faster disaster Climate change fuels flash droughts intense downpours and storms,The run of extreme weather events around the world seems to be never ending After the northern summer of extreme heat and disastrous fires we ve seen more exceptional autumn weather over Europe with record breaking heat in the UK
drought,2023-09-18,ESPN,Ten Hag needs results at Man United quickly to avoid familiar fate,The past decade shows a worrying trend of Manchester United managers hitting turbulence after an impressive first season and never fully recovering
