LABEL,Date,Source,Title,Headline
wildfire,2023-09-27,CBC News,This has been the worst wildfire season on record What could have in store,Canada is coming off its worst wildfire season ever Can the devastating fires of help prepare us for
wildfire,2023-09-05,Theregister.com,Guild behind actors strike fears video game workers also at risk from AI,Authorizes strike for voice and motion capture talent at major game studios The Screen Actors Guild American Federation of Television and Radio Artists has authorized its members employed in the interactive media industry at giant games studios including
fire,2023-09-20,Engadget,Amazon debuts Eye Gaze accessibility features on the Fire Max tablet,After spending a chunk of its event today talking about Alexa upgrades Amazon announced two new accessibility features coming to its devices later this year First is Eye Gaze on Alexa which will let those with mobility or speech disabilities use their gaze
fire,2023-09-07,Engadget,Amazon s Fire TV Stick K Max drops back down to,A few of Amazon s Fire TV Sticks are on sale again including the Fire TV Stick K Max which is down to It went for during July s Prime Day but that deal was only for Prime members this one s open to any one with the funds and inclination This i
fire,2023-09-27,Lifehacker.com,This Whisper Quiet Air Purifier is Right Now,Whether you live in a fire prone area have pets or burn your food often you could benefit from having a great air purifier And it doesn t hurt to get one at a great price Amazon is currently selling the Morento H Air Purifier for off when you click
fire,2023-10-03,BBC News,Watch Shoppers flee after shooting in Bangkok mall,Crowds ran from the scene after a teenager opened fire at a shopping mall in Thailand
fire,2023-10-02,BBC News,Huge fire breaks out at police facility in Egypt,Videos are being shared across social media of the blaze which local media says has injured more than people
fire,2023-10-02,BBC News,Fire hit Spain nightclubs were told to close in,The firm running the Teatre and Fonda Milagros had only had a permit to run one of the nightclubs said an official
fire,2023-10-02,Gizmodo.com,Your Guide to October s Much Anticipated Ring of Fire Solar Eclipse,The Americas are in for an astronomical treat on October as an annular solar eclipse known as the ring of fire will be visible across vast swaths of the Western Hemisphere Read more
fire,2023-09-22,Engadget,Solo Stove s sitewide coupons give you up to an extra off,Solo Stove makes some of the best pizza ovens and other outdoor gear around and thanks to some sitewide coupons you can pick up the company s products for less than usual Use SAVE to get off purchases over SAVE to get off anything over
fire,2023-09-22,Engadget,The best October Amazon Prime Day early access deals for,No the sale hasn t started yet Amazon s second Prime related event for is officially called Prime Big Deal Days and will happen October and This is the second year for a fall based site wide Amazon sale and we re already seeing discounts pop up
fire,2023-10-02,Engadget,The best early Amazon October Prime Day Deals for,Amazon s second Prime related event for is officially called Prime Big Deal Days and will happen October and This is the second year in a row for a fall based site wide Amazon sale and we re already seeing discounts pop up You ll need a Prime me
fire,2023-09-10,Gizmodo.com,The Haunted Mansion Remake Will Scare Disney in October,Back in July Disney released its remake of Haunted Mansion which didn t really light the world on spectral fire when it came out Part of it was due to other big movies releasing in late July at the time and stealing whatever thunder it could ve possibly ha
fire,2023-09-20,Engadget,Kids will soon be able to have natural conversations with Alexa,Amazon has used today s hardware event to go all in on Alexa s new LLM infused capabilities touting how easy it ll soon be to have a natural sounding conversation with the bot This also extends to kids as the company just announced Explore With Alexa Th
fire,2023-09-20,Gizmodo.com,Amazon s Big Bet on New Devices and AI,At Amazon s Fall Devices Event the pressure was on to come up with a hit product that would stun the world the way Alexa and the Echo speaker did a decade ago The event held at Amazon s HQ in Arlington VA was Amazon s first in person event since before C
fire,2023-09-20,Android Central,Amazon s new Fire HD Kids tablets are lighter faster and cheaper,If it s time to upgrade your child s tablet now s a great time do so with the new and improved Fire HD Kids and Fire HD Kids Pro
fire,2023-09-23,Slashdot.org,California is Using AI to Spot Wildfires Early,CNN reports The California Department of Forestry and Fire Protection known as Cal Fire says it has a new tool to battle wildfires before they explode artificial intelligence I think it is a game changer It has enhanced our abilities to validate s
fire,2023-09-27,BBC News,What we know about wedding blaze in Iraq s Qaraqosh,More than people have been killed by a blaze that swept through a wedding party in Qaraqosh
fire,2023-09-04,BBC News,Violent protests after Quran burning in Sweden,Police arrest three people and detain after a violent protest sparked by the burning of a Quran
fire,2023-09-20,CNET,Amazon s Fire TV Soundbar Takes on Roku Wireless Speakers CNET,The soundbar promises to sync automatically with your Fire TV stick
fire,2023-09-05,ReadWrite,Vision AI Prevent Fire and Smoke Hazards in the Workplace,Fire hazards are a global scourge indiscriminately wreaking havoc on homes businesses and other infrastructures They can have devastating consequences The post Vision AI Prevent Fire and Smoke Hazards in the Workplace appeared first on ReadWrite
fire,2023-09-18,Android Central,The man who built Microsoft Surface could be heading to Amazon,It s been a long time since Amazon tried a new mobile device but a veteran Microsoft Surface exec could rekindle Amazon s Fire business
fire,2023-09-29,Engadget,The best early October Prime Day deals you can get for,Amazon s second Prime related event for is officially called Prime Big Deal Days and will happen October and This is the second year in a row for a fall based site wide Amazon sale and we re already seeing discounts pop up You ll need a Prime me
fire,2023-09-18,Engadget,Amazon will hold its Prime Big Deal Days sale on October and,Amazon is having a second sale this fall exclusively for Prime members as it did last year and though we knew it was happening in October we didn t yet have an exact date Now Amazon has announced that the sale will happen on October and and even ga
fire,2023-09-12,Business Insider,Video appears to show Ukraine using a Shark drone to pinpoint Russian Buk missile systems then destroying them with HIMARS,Footage from the Ukrainian drone shows mobile missile launchers sitting in fields before being struck by fire and smoke
fire,2023-09-27,Engadget,Counter Strike is now available as a free upgrade to CS GO,Valve launched Counter Strike today The long rumored game officially announced in March has replaced Counter Strike Global Offensive as a free upgrade It uses Valve s in house Source engine leading to sharper textures more believable lighting and n
fire,2023-10-01,Business Insider,Video appears to show a Russian tank hitting a mine and running out of control before sinking into water,A new video appears to show a Russian tank hitting a mine in southern Ukraine catching fire and sinking in a to a body of water
fire,2023-10-02,Business Insider,An Australian drone killer air defense system could make it much cheaper for Ukraine to shoot Russian drones out of the sky,Shooting down Russia s drones in Ukraine costs millions of dollars in ammunition The Slinger anti drone system is designed to cost around to fire
fire,2023-09-06,Business Insider,Ukraine used US supplied Bradley IFV to evacuate civilians while under heavy fire including one woman with her cat report,Ukrainian soldiers told CNN they used a Bradley IFV to take elderly civilians out of Robotyne after a month of fighting and under Russian fire
fire,2023-09-07,Business Insider,Walmart is making an unusual move to deter theft by building a mini police station inside one of its stores,The Atlanta location is slated to reopen after an arson attack in which shoplifters lit a fire in the store to distract from their theft
fire,2023-09-26,Business Insider,US made ATACMS cluster missiles could give Ukraine s HIMARS the power to punish Russia s artillery and cut off its army former US artillery officer says,Counter battery fire is just going to increase in lethality and range Dan Rice who has served as an adviser to Ukraine s military told Insider
fire,2023-10-02,Business Insider,Walgreens says cooler screens caught fire and showed the wrong prices in its stores,Cooler Screens displays designed to show ads caught fire displayed incorrect prices and suffered other problems at Walgreens per documents filed in a lawsuit
fire,2023-09-30,Business Insider,Republicans are accusing a Democratic lawmaker of pulling a fire alarm to buy time before a House vote on the stopgap spending bill,Rep Jamaal Bowman pulled a fire alarm in Cannon this morning An investigation into why it was pulled is underway Rep Bryan Steil wrote on X
fire,2023-09-22,Gizmodo.com,It s Been a Rough Week for Rockets,It was an unfortunate week for the rocket industry with three distinct setbacks occurring and challenging the plans of three different aerospace companies across the globe Read more
fire,2023-09-20,Android Central,Amazon s next gen Fire TV K streaming devices get nifty upgrades and generative AI,Amazon s Devices Services Event introduces various streaming devices for in house entertainment
fire,2023-09-03,Slashdot.org,After Hurricane Caused Flooding Some EVs Exposed To Saltwater Caught Fire,CBS News reports Floridians battered by Hurricane Idalia this week may not have expected another threat that floodwaters could cause their cars to suddenly burst into flames Yet that s exactly what happened when two electric vehicles caught fire after bei
fire,2023-09-11,CNET,Ring of Fire Eclipse Will Be Visible From States in October CNET,Cue up the hit Johnny Cash song because from Oregon to Texas you ll be able to see the rare and fiery sight
fire,2023-09-20,CNET,Amazon Updates Fire TV Sticks With New K and K Max Versions CNET,Amazon s streaming sticks are getting faster
fire,2023-09-08,Engadget,Disney Basic is just for three months plus the rest of this week s best tech deals,Labor Day sales have ended Amazon s next Prime related sale isn t until October and Apple won t announce new products and likely discount older ones until next week In this in between time there are still a few worthy deals out there for those looking to
fire,2023-09-04,BBC News,Gilberto Hern ndez Panama national team footballer killed by gunmen,Gilberto Hern ndez s father urged young people to stop the violence after the death of his son
fire,2023-09-19,Hackaday,Powerful Nerf Blaster Aims To Fire Darts Per Second,Nerf has made plenty of fully automatic blasters over the years but their toys typically lack punch precision and fire rate DprintedLife set about building a blaster to rectify that last read more
fire,2023-09-18,Engadget,Amazon will hold its Prime Big Deal Days sale on October and,Amazon is having a second sale this fall exclusively for Prime members as it did last year and though we knew it was happening in October we didn t yet have an exact date Now Amazon has announced that the sale will happen on October and and even ga
fire,2023-09-06,Engadget,YouTube is testing fewer longer ad breaks on its TV apps,YouTube is testing a different approach to ads on smart TVs as well as its apps on connected devices like Apple TV and game consoles The platform is experimenting with having longer ad breaks but fewer of them on those devices which it refers to as conne
fire,2023-09-26,Engadget,Spotify s new Jam feature lets friends collab on party playlists,Spotify is rolling out a new feature called Jam which will give friends a way to curate a single playlist on the service and listen to it together in real time Participants in a Jam session can contribute tracks to a shared queue which they can access wh
fire,2023-09-22,Engadget,Amazon s Prime Video will show ads unless you pay more per month,Prime Video users will soon see ads on shows and movies unless they pay an extra per month on top of their regular Prime subscription Amazon has announced Starting in early Prime Video shows and movies will include limited advertisements the com
fire,2023-09-28,NPR,How rumors and conspiracy theories got in the way of Maui s fire recovery,Some of the rumors and conspiracy theories were driven by the island s history but others were pushed by social media influencers and foreign governments
fire,2023-09-09,NPR,Pop up units spring up after Maui fire disaster giving families a place to call home,In Hawaii people who lost their homes to wildfires could soon be living in a pop up village with space for around people
fire,2023-09-18,NPR,Generac is recalling around generators that pose a fire and burn hazard,At least three incidents involving the recalled generators left people with severe burns Generac is offering a free repair kit to consumers
fire,2023-09-16,NPR,DNA tests lower the death toll in Maui fire to,Officials previously said at least people had died in the fire but further testing showed they had multiple DNA samples from some of the victims The number of those who are missing fell to
fire,2023-09-06,NPR,A Vietnam veteran helicopter pilot receives the Medal of Honor for a daring rescue,Capt Larry Taylor received the award from President Biden for flying into heavy enemy fire to save four members of a reconnaissance team from almost certain death as they were about to be overrun
fire,2023-09-18,Slate Magazine,I ve Become Obsessed With Tracking Wildfires I Noticed a Scary Truth,Fire season is long gone
fire,2023-10-03,Gizmodo.com,Troubling Motor Issues Will Delay Revival of Europe s Vega C Rocket,After a disheartening failure in December the return flight of Europe s Vega C rocket has been pushed to late The delay just revealed by the European Space Agency stems from a required redesign of the rocket s motor nozzle Read more
fire,2023-09-22,Gizmodo.com,Amazon Restricts Authors to Self Publishing Three Books a Day a Totally Human Amount,As authors grapple with the anxiety of an impending AI takeover in the publishing world Amazon wants you to know that it s taking those concerns very seriously The bookstore turned commerce giant has revealed a new self publishing limit that cannot exceed t
fire,2023-09-10,Business Insider,A second Nikola electric semi truck caught fire during tests to determine the cause of another blaze,Nikola confirmed the thermal incident to Bloomberg It follows the recall of hundreds of trucks following two battery fires in June
fire,2023-09-21,Joelonsoftware.com,Fire and Motion,Sometimes I just can t get anything done Sure I come into the office putter around check my email every ten seconds read the web even do a few brainless tasks like paying the American E
fire,2023-09-15,NPR,Preparing homes for wildfires is big business that s only getting started,Climate change technological leaps panicked insurers the shifting sense of responsibility All are powering the still nascent but fast growing industry of preparing homes for wildfires
fire,2023-09-27,Time,Fire at a Christian Wedding in Northern Iraq Kills More Than Injures,A raging fire seemingly caused by fireworks set off to celebrate a Christian wedding consumed a hall packed with guests
fire,2023-09-27,ESPN,Sources MSU expected to fire Tucker on Wed,Michigan State is expected to fire football coach Mel Tucker for cause Wednesday sources told ESPN s Pete Thamel
fire,2023-09-20,Business Insider,Videos show a massive fuel tank explosion after a suspected suicide drone strike in Putin s prized resort town,People living nearby said they heard sounds resembling a moped before a loud explosion according to Telegram channel SHOT
fire,2023-10-02,HuffPost,At Least Dead In Spain Nightclub Fire,The blaze ripped through the Teatre nightclub in the southeastern city of Murcia
fire,2023-09-20,Digital Trends,Amazon launches new Fire TV sticks and its first Fire TV soundbar,Amazon has debuted two new Fire TV stick and its first Fire TV soundbar
fire,2023-10-02,ESPN,Angels fire Nevin a day after season ends,A day after the club finished the season at Phil Nevin was fired as manager of the Los Angeles Angels the team announced Monday but general manager Perry Minasian will remain with the club in the same role and speak to the media on Tuesday
fire,2023-09-29,ESPN,Giants fire Kapler after seasons playoff trip,The Giants have fired manager Gabe Kapler with three games to go in his fourth season with the team He led San Francisco to one postseason trip in the team s only win season since
fire,2023-09-28,The Drive,Il Cargo Jet s Disastrous Landing In Mali Captured On Video,Video footage of the incident which took place last week shows the aircraft careering off the runway before exploding in a ball of fire
fire,2023-09-25,Yahoo Entertainment,Mel Tucker s attorney Michigan State doesn t have cause to fire suspended coach over phone sex,Mel Tucker s attorney said Monday that Michigan State does not have cause to fire its suspended football coach after Tucker acknowledged having phone sex
fire,2023-09-11,Business Insider,Russians opened fire on a Ukrainian flag tied to balloons revealing their position for a counterattack Ukraine says,Ukraine s military flew a massive flag attached to helium balloons into occupied territory over the weekend
fire,2023-09-08,Business Insider,PHOTOS Step inside one of the US made Bradley fighting vehicles keeping Ukrainian troops alive through mines and enemy fire,Take a look inside a Bradley operated by Ukraine s th Mechanized Brigade in the southeastern Zaporizhzhia region
fire,2023-09-13,Business Insider,The US is playing with fire as oil reserves plunge to a year low markets guru Larry McDonald says,Falling oil inventories put America s energy security at risk potentially making the country more vulnerable to to supply disruptions and price volatility in the global market
fire,2023-09-25,Business Insider,A Ukrainian commando described being thrown off a speedboat while under fire then telling his comrades to abandon him,A Ukrainian commando fell overboard a speedboat during a special operation in the Black Sea and spent hours in the ocean
fire,2023-09-04,Engadget,The Morning After Facebook may offer paid ad free plans in Europe,Would you be willing to pay for Facebook Meta may add a paid subscription option to Instagram and Facebook for users in Europe according to The New York Times The ad free tier addresses European Union EU regulations that have diminished some of Meta s mo
fire,2023-09-28,Ucr.edu,Scientists unveil fire safe fuel,UC Riverside chemical engineers have designed a fuel that ignites only with the application of electric current Since it doesn t react to flames and cannot start accidental fires during storage or transport it is a safe liquid fuel
fire,2023-09-07,Business Insider,The war in Ukraine is pushing Russia away from its WWII style artillery strategy and experts say it s a concerning trend,Russia s military has long relied on massive firepower to make up for its other shortcomings but that s getting harder to do in Ukraine
fire,2023-09-20,Wired,A Pair of Sun Probes Just Got Closer to Solving a Solar Enigma,The solar corona is hotter than expected and scientists are using European Space Agency and NASA spacecraft to figure out why
fire,2023-09-19,BBC News,Azerbaijan launches operation against Nagorno Karabakh,The defence ministry begins anti terrorist operations in its breakaway region under Armenian control
fire,2023-09-08,BBC News,Kim Jong Un reveals nuclear attack submarine,North Korea has not yet demonstrated that the submarine is actually operational
fire,2023-09-28,Boing Boing,Wedding fire that killed people in Iraq started by indoor fireworks as seen in new video,A wedding in northern Iraq ended in tragedy on Tuesday after a fire broke out killing at least people and injuring at least others The blaze was apparently started by indoor fireworks which ignited the ceiling according to new video see below po
fire,2023-09-05,ABC News,South Africa announces official inquiry into deadly Johannesburg building fire,The South African government says a retired judge will lead an official inquiry into last week s deadly fire at a derelict building in downtown Johannesburg
fire,2023-10-01,ABC News,At least dead in Spain nightclub fire,At least people were killed and several others were injured when a fire early Sunday ripped through adjoining nightclubs in Spain authorities said
fire,2023-10-02,The New Yorker,What Really Started the Great Chicago Fire,The famous disaster razed a metropolis and spread a pack of colorful lies To sift through the ashes today is to encounter some uncomfortable truths
fire,2023-10-02,BBC News,North Dakota state senator and his family die in plane crash,North Dakota state senator Doug Larsen s plane crashed soon after taking off in Utah officials say
fire,2023-09-15,Yahoo Entertainment,He s playing with fire Former DOJ official on Trump s intimidation tactics,According to prosecutors with special counsel Jack Smith s office former President Donald Trump s public statements about the federal election interference
fire,2023-09-27,BBC News,Iraq wedding fire How the blaze unfolded,At least people have died and others injured after a fire broke out during a wedding in Iraq
fire,2023-09-19,Yahoo Entertainment,One killed by Israeli fire at Gaza border Palestinian officials say,Israeli forces shot and killed a Palestinian man along the Gaza Israel border on Tuesday Palestinian health officials said the first such fatality in what
fire,2023-09-20,ReadWrite,Amazon s Autumn Hardware Event a Futuristic Gadget Extravaganza,Today September Amazon introduced an impressive lineup of over a dozen new products at their autumn hardware event The post Amazon s Autumn Hardware Event a Futuristic Gadget Extravaganza appeared first on ReadWrite
fire,2023-09-20,Slashdot.org,Almost Everyone in Europe is Breathing Toxic Air,Europe is facing a severe public health crisis with almost everyone across the continent living in areas with dangerous levels of air pollution an investigation by the Guardian has found From the report Analysis of data gathered using cutting edge metho
fire,2023-09-27,ABC News,More than dead over injured in fire at Iraq wedding party,Over people were killed and over others injured in a fire that happened at a wedding in Iraq
fire,2023-09-07,ABC News,No words death toll continues to rise years later,The New York City Fire Department has added new names to its World Trade Center Memorial Wall
fire,2023-09-22,ABC News,Teenager arrested after starting massive acre fire when setting off fireworks,A teenager has been arrested after igniting a massive acre fire when he set off fireworks with his friends
fire,2023-09-06,The Verge,X s Community Notes feature will now include videos,Community Notes users can now directly add additional context to videos which will automatically show up on any matching content
fire,2023-09-04,Digital Trends,Some Tesla fires were reportedly caused by Idalia floods,Fire crews in places hit by Idalia have warned owners of EVs that took on water to move them away from buildings as their batteries could be a fire risk
fire,2023-09-12,Kotaku,Don t Waste All Your Baldur s Gate Scrolls In Battle Do This Instead,Scrolls are some of the most useful items you can find in your Baldur s Gate adventure letting your characters expend them to cast spells they may not otherwise know Because of this they can really come in handy in a pinch when you realize you have a sc
fire,2023-09-10,BBC News,Ukraine war Kyiv foils big Russian drone attack officials say,Ukraine s capital is showered in debris from intercepted Russian drones city officials say
fire,2023-09-20,CNET,Everything Amazon Just Announced Fire TV Stick K Max Fire HD Kids Pro Fire TV Soundbar and More CNET,Starring Alexa intelligence everywhere
fire,2023-09-04,ABC News,Clashes erupt in Sweden s third largest city after another Quran burning,Police in Sweden say clashes have erupted in an immigrant neighborhood in the third largest city after an anti Muslim protester set fire to the Quran
fire,2023-09-04,ABC News,Member of Panama s national soccer team shot and killed in Colon nd in years,A member of Panama s national soccer team has been killed after gunmen opened fire on a group of people gathered in the country s violent port city of Colon
fire,2023-09-14,ABC News,Wisconsin AG sues after Republicans vote to fire state elections chief,Wisconsin Attorney General Josh Kaul on Thursday filed a lawsuit on behalf of Meagan Wolfe whom the state Senate has just voted along party lines to fire
fire,2023-09-30,ABC News,Bowman says triggering alarm ahead of House spending bill vote was innocent mistake,U S Capitol Police are investigating after a fire alarm was triggered in a congressional office building on Saturday before the House vote on a stopgap spending bill
fire,2023-09-24,Boing Boing,Oklahoma judge arrested after opening fire while driving and intentionally crashing car into another,Brian Lovell a judge in Garfield County Oklahoma went full rootin tootin last week opening fire on parked cars while driving his own and crashing it intentionally thereafter He told officers someone had cut him off he was charged with misdemeanor re
fire,2023-09-12,ABC News,year old boy accidentally shot when barrel with guns inside set on fire,An year old Florida boy was accidentally shot when a burn barrel that had guns inside was set on fire authorities said
